{
  "metadata": {
    "id": "prompt-series-06-advanced-techniques",
    "title": "Prompt Engineering V1–V5 · ADVANCED · 3 KỸ THUẬT",
    "description": "Video dọc 9:16 thuộc series prompt engineering thực nghiệm.",
    "author": "Opus AI Video Engine",
    "version": "1.0.0",
    "width": 1080,
    "height": 1920,
    "fps": 30,
    "background": "#080b10"
  },
  "duration": 20,
  "assets": [],
  "scenes": [
    {
      "id": "06-advanced-techniques-hook",
      "title": "06-advanced-techniques-hook",
      "start": 0,
      "duration": 4,
      "composition": {
        "type": "html",
        "html": ""
      },
      "layers": [
        {
          "id": "06-advanced-techniques-hook-top-rule",
          "kind": "shape",
          "x": 0,
          "y": 0,
          "width": 1080,
          "height": 10,
          "fill": "#32d6c5",
          "radius": 0,
          "enter": {
            "preset": "draw-x",
            "delay": 0,
            "duration": 0.45
          }
        },
        {
          "id": "06-advanced-techniques-hook-episode",
          "kind": "text",
          "text": "TẬP 06 / 07",
          "x": 84,
          "y": 78,
          "width": 240,
          "height": 36,
          "fontSize": 24,
          "fontWeight": 820,
          "color": "#32d6c5",
          "lineHeight": 1.08,
          "enter": {
            "preset": "fade-down",
            "delay": 0.02,
            "duration": 0.4
          }
        },
        {
          "id": "06-advanced-techniques-hook-label",
          "kind": "text",
          "text": "ADVANCED · 3 KỸ THUẬT",
          "x": 350,
          "y": 78,
          "width": 640,
          "height": 36,
          "fontSize": 24,
          "fontWeight": 760,
          "color": "#aab7c4",
          "lineHeight": 1,
          "align": "right",
          "enter": {
            "preset": "fade-down",
            "delay": 0.08,
            "duration": 0.4
          }
        },
        {
          "id": "06-advanced-techniques-hook-grid-v1",
          "kind": "shape",
          "x": 84,
          "y": 178,
          "width": 912,
          "height": 1,
          "fill": "rgba(255,255,255,0.08)",
          "radius": 0,
          "enter": {
            "preset": "draw-x",
            "delay": 0.08,
            "duration": 0.45
          }
        },
        {
          "id": "06-advanced-techniques-hook-progress-base",
          "kind": "shape",
          "x": 84,
          "y": 1742,
          "width": 912,
          "height": 8,
          "fill": "rgba(255,255,255,0.10)",
          "radius": 4,
          "enter": {
            "preset": "fade",
            "delay": 0.05,
            "duration": 0.35
          }
        },
        {
          "id": "06-advanced-techniques-hook-progress-fill",
          "kind": "shape",
          "x": 84,
          "y": 1742,
          "width": 182,
          "height": 8,
          "fill": "#32d6c5",
          "radius": 4,
          "enter": {
            "preset": "draw-x",
            "delay": 0.18,
            "duration": 0.65
          }
        },
        {
          "id": "06-advanced-techniques-hook-footer",
          "kind": "text",
          "text": "PROMPT ENGINEERING · THỰC NGHIỆM V1 → V5",
          "x": 84,
          "y": 1790,
          "width": 912,
          "height": 28,
          "fontSize": 20,
          "fontWeight": 720,
          "color": "#aab7c4",
          "lineHeight": 1,
          "align": "center",
          "enter": {
            "preset": "fade",
            "delay": 0.32,
            "duration": 0.4
          }
        },
        {
          "id": "06-advanced-techniques-hook-accent-line",
          "kind": "shape",
          "x": 84,
          "y": 312,
          "width": 132,
          "height": 12,
          "fill": "#32d6c5",
          "radius": 6,
          "enter": {
            "preset": "draw-x",
            "delay": 0.12,
            "duration": 0.55
          }
        },
        {
          "id": "06-advanced-techniques-hook-title",
          "kind": "text",
          "text": "Ba kỹ thuật prompt nâng cao đáng thử",
          "x": 84,
          "y": 382,
          "width": 900,
          "height": 430,
          "fontSize": 88,
          "fontWeight": 860,
          "color": "#f4f7f8",
          "lineHeight": 0.98,
          "enter": {
            "preset": "wipe-up",
            "delay": 0.24,
            "duration": 0.72
          }
        },
        {
          "id": "06-advanced-techniques-hook-subtitle",
          "kind": "text",
          "text": "Dùng khi zero-shot và instruction thông thường chưa đủ ổn định.",
          "x": 88,
          "y": 890,
          "width": 850,
          "height": 180,
          "fontSize": 40,
          "fontWeight": 580,
          "color": "#aab7c4",
          "lineHeight": 1.18,
          "enter": {
            "preset": "fade-up",
            "delay": 0.88,
            "duration": 0.62
          }
        },
        {
          "id": "06-advanced-techniques-hook-orb-a",
          "kind": "shape",
          "x": 820,
          "y": 1260,
          "width": 190,
          "height": 190,
          "fill": "#32d6c522",
          "radius": 95,
          "enter": {
            "preset": "scale-in",
            "delay": 1.15,
            "duration": 0.55
          },
          "emphasis": {
            "preset": "float",
            "delay": 1.7,
            "duration": 1.8,
            "iterations": "infinite"
          }
        },
        {
          "id": "06-advanced-techniques-hook-orb-b",
          "kind": "shape",
          "x": 690,
          "y": 1398,
          "width": 90,
          "height": 90,
          "fill": "#6d8cff33",
          "radius": 45,
          "enter": {
            "preset": "scale-in",
            "delay": 1.35,
            "duration": 0.45
          },
          "emphasis": {
            "preset": "float",
            "delay": 1.9,
            "duration": 1.4,
            "iterations": "infinite"
          }
        },
        {
          "id": "06-advanced-techniques-hook-swipe",
          "kind": "text",
          "text": "PROMPT LAB / CASE STUDY",
          "x": 84,
          "y": 1560,
          "width": 700,
          "height": 44,
          "fontSize": 28,
          "fontWeight": 780,
          "color": "#32d6c5",
          "lineHeight": 1.08,
          "enter": {
            "preset": "fade",
            "delay": 1.5,
            "duration": 0.5
          }
        }
      ],
      "animation": []
    },
    {
      "id": "06-advanced-techniques-prompt",
      "title": "06-advanced-techniques-prompt",
      "start": 4,
      "duration": 4,
      "composition": {
        "type": "html",
        "html": ""
      },
      "layers": [
        {
          "id": "06-advanced-techniques-prompt-top-rule",
          "kind": "shape",
          "x": 0,
          "y": 0,
          "width": 1080,
          "height": 10,
          "fill": "#32d6c5",
          "radius": 0,
          "enter": {
            "preset": "draw-x",
            "delay": 0,
            "duration": 0.45
          }
        },
        {
          "id": "06-advanced-techniques-prompt-episode",
          "kind": "text",
          "text": "TẬP 06 / 07",
          "x": 84,
          "y": 78,
          "width": 240,
          "height": 36,
          "fontSize": 24,
          "fontWeight": 820,
          "color": "#32d6c5",
          "lineHeight": 1.08,
          "enter": {
            "preset": "fade-down",
            "delay": 0.02,
            "duration": 0.4
          }
        },
        {
          "id": "06-advanced-techniques-prompt-label",
          "kind": "text",
          "text": "ADVANCED · 3 KỸ THUẬT",
          "x": 350,
          "y": 78,
          "width": 640,
          "height": 36,
          "fontSize": 24,
          "fontWeight": 760,
          "color": "#aab7c4",
          "lineHeight": 1,
          "align": "right",
          "enter": {
            "preset": "fade-down",
            "delay": 0.08,
            "duration": 0.4
          }
        },
        {
          "id": "06-advanced-techniques-prompt-grid-v1",
          "kind": "shape",
          "x": 84,
          "y": 178,
          "width": 912,
          "height": 1,
          "fill": "rgba(255,255,255,0.08)",
          "radius": 0,
          "enter": {
            "preset": "draw-x",
            "delay": 0.08,
            "duration": 0.45
          }
        },
        {
          "id": "06-advanced-techniques-prompt-progress-base",
          "kind": "shape",
          "x": 84,
          "y": 1742,
          "width": 912,
          "height": 8,
          "fill": "rgba(255,255,255,0.10)",
          "radius": 4,
          "enter": {
            "preset": "fade",
            "delay": 0.05,
            "duration": 0.35
          }
        },
        {
          "id": "06-advanced-techniques-prompt-progress-fill",
          "kind": "shape",
          "x": 84,
          "y": 1742,
          "width": 365,
          "height": 8,
          "fill": "#32d6c5",
          "radius": 4,
          "enter": {
            "preset": "draw-x",
            "delay": 0.18,
            "duration": 0.65
          }
        },
        {
          "id": "06-advanced-techniques-prompt-footer",
          "kind": "text",
          "text": "PROMPT ENGINEERING · THỰC NGHIỆM V1 → V5",
          "x": 84,
          "y": 1790,
          "width": 912,
          "height": 28,
          "fontSize": 20,
          "fontWeight": 720,
          "color": "#aab7c4",
          "lineHeight": 1,
          "align": "center",
          "enter": {
            "preset": "fade",
            "delay": 0.32,
            "duration": 0.4
          }
        },
        {
          "id": "06-advanced-techniques-prompt-eyebrow",
          "kind": "text",
          "text": "PROMPT / INPUT",
          "x": 84,
          "y": 260,
          "width": 620,
          "height": 42,
          "fontSize": 26,
          "fontWeight": 820,